{
  "$schema": "../../../schemas/theme.schema.json",
  "id": "minimal-farm",
  "name": "Tema quinta",
  "locale": "pt-PT",
  "roles": {
    "world": {
      "singular": "quinta",
      "plural": "quintas",
      "gender": "f"
    },
    "profile": {
      "singular": "ajudante",
      "plural": "ajudantes",
      "gender": "m"
    },
    "board": {
      "singular": "painel",
      "plural": "painéis",
      "gender": "m"
    },
    "checkin": {
      "singular": "portão",
      "plural": "portões",
      "gender": "m"
    },
    "home": {
      "singular": "casinha",
      "plural": "casinhas",
      "gender": "f"
    },
    "vault": {
      "singular": "armazém",
      "plural": "armazéns",
      "gender": "m"
    },
    "showcase": {
      "singular": "montra",
      "plural": "montras",
      "gender": "f"
    },
    "reward": {
      "singular": "cesto",
      "plural": "cestos",
      "gender": "m"
    },
    "collectible": {
      "singular": "animal",
      "plural": "animais",
      "gender": "m"
    },
    "party": {
      "singular": "rebanho",
      "plural": "rebanhos",
      "gender": "m"
    },
    "reserve": {
      "singular": "pasto",
      "plural": "pastos",
      "gender": "m"
    }
  },
  "tiers": {
    "low": "Pequeno",
    "mid": "Médio",
    "high": "Grande"
  },
  "rewardArt": {
    "low": {
      "emoji": "🥚"
    },
    "mid": {
      "emoji": "🧺"
    },
    "high": {
      "emoji": "🌟"
    }
  },
  "profileSymbols": [
    "🐄",
    "🐖",
    "🐔",
    "🐑",
    "🐴",
    "🦆",
    "🐇",
    "🐐",
    "🌻",
    "🌽",
    "🍎",
    "🚜",
    "🥕",
    "🐝",
    "🍓",
    "🌳"
  ],
  "map": {
    "background": {
      "emoji": "🌾"
    },
    "aspectRatio": 0.5625
  },
  "places": {
    "board": {
      "x": 8,
      "y": 8,
      "width": 38,
      "height": 20,
      "art": {
        "emoji": "🪧"
      },
      "transition": {
        "kind": "move",
        "durationMs": 400
      }
    },
    "checkin": {
      "x": 54,
      "y": 8,
      "width": 38,
      "height": 20,
      "art": {
        "emoji": "🚪"
      },
      "transition": {
        "kind": "move",
        "durationMs": 400
      }
    },
    "home": {
      "x": 31,
      "y": 38,
      "width": 38,
      "height": 22,
      "art": {
        "emoji": "🏡"
      },
      "transition": {
        "kind": "fade",
        "durationMs": 300
      }
    },
    "vault": {
      "x": 8,
      "y": 70,
      "width": 38,
      "height": 20,
      "art": {
        "emoji": "🧺"
      },
      "transition": {
        "kind": "move",
        "durationMs": 400
      }
    },
    "showcase": {
      "x": 54,
      "y": 70,
      "width": 38,
      "height": 20,
      "art": {
        "emoji": "🖼️"
      },
      "transition": {
        "kind": "move",
        "durationMs": 400
      }
    }
  },
  "homeVariants": {
    "adult": {
      "emoji": "🏠"
    },
    "child": {
      "emoji": "🛖"
    }
  },
  "character": {
    "art": {
      "emoji": "🧑‍🌾"
    },
    "lines": {
      "greeting": [
        "Bom dia! Há trabalho na quinta.",
        "Olá, ajudante!"
      ],
      "congrats": [
        "Excelente trabalho!",
        "Boa colheita!"
      ],
      "doubt": [
        "Sem pressa. A quinta espera por ti.",
        "Tudo bem, fica para mais tarde."
      ],
      "farewell": [
        "Até amanhã!",
        "Bom descanso."
      ]
    }
  },
  "install": {
    "name": "Quinta",
    "themeColor": "#2e5e3a",
    "backgroundColor": "#f4f8f0",
    "icons": {
      "small": {
        "image": "assets/icons/icon-192.png"
      },
      "large": {
        "image": "assets/icons/icon-512.png"
      },
      "maskable": {
        "image": "assets/icons/icon-maskable-512.png"
      },
      "apple": {
        "image": "assets/icons/apple-touch-icon.png"
      }
    }
  }
}
